No.;Time;Source;Destination;Protocol;Length;Info;;;time 1;time 2;Delay;Delay 1;Delay 2;jitter 
8;0.260205;192.168.1.7;40.126.16.166;TCP;66;62859  >  443 [SYN] Seq=0 Win=64240 Len=0 MSS=1460 WS=256 SACK_PERM=1;;;0.260205;0.345624;0.085419;0.08522;0.000199;-0.085021
9;0.345624;40.126.16.166;192.168.1.7;TCP;66;443  >  62859 [SYN, ACK] Seq=0 Ack=1 Win=65535 Len=0 MSS=1440 WS=256 SACK_PERM=1;;;0.345624;0.345823;0.000199;-0.001899;0.002098;0.003997
10;0.345823;192.168.1.7;40.126.16.166;TCP;54;62859  >  443 [ACK] Seq=1 Ack=1 Win=66048 Len=0;;;0.345823;0.347921;0.002098;-0.061215;0.063313;0.124528
11;0.347921;192.168.1.7;40.126.16.166;TLSv1.2;342;Client Hello;;;0.347921;0.411234;0.063313;0.040532;0.022781;-0.017751
12;0.411234;192.168.1.7;35.197.154.200;TCP;55;62843  >  443 [ACK] Seq=1 Ack=1 Win=260 Len=1 [TCP segment of a reassembled PDU];;;0.411234;0.434015;0.022781;0.021789;0.000992;-0.020797
13;0.434015;35.197.154.200;192.168.1.7;TCP;66;443  >  62843 [ACK] Seq=1 Ack=2 Win=139 Len=0 SLE=1 SRE=2;;;0.434015;0.435007;0.000992;0.000702;0.00029;-0.000412
14;0.435007;40.126.16.166;192.168.1.7;TCP;1506;443  >  62859 [ACK] Seq=1 Ack=289 Win=16776192 Len=1452 [TCP segment of a reassembled PDU];;;0.435007;0.435297;0.00029;0.000235;5.5E-05;-0.00018
15;0.435297;40.126.16.166;192.168.1.7;TCP;1506;443  >  62859 [ACK] Seq=1453 Ack=289 Win=16776192 Len=1452 [TCP segment of a reassembled PDU];;;0.435297;0.435352;5.5E-05;-0.00022;0.000275;0.000495
16;0.435352;192.168.1.7;40.126.16.166;TCP;54;62859  >  443 [ACK] Seq=289 Ack=2905 Win=66048 Len=0;;;0.435352;0.435627;0.000275;-4E-06;0.000279;0.000283
17;0.435627;40.126.16.166;192.168.1.7;TCP;1506;443  >  62859 [ACK] Seq=2905 Ack=289 Win=16776192 Len=1452 [TCP segment of a reassembled PDU];;;0.435627;0.435906;0.000279;0.000227;5.2E-05;-0.000175
18;0.435906;40.126.16.166;192.168.1.7;TCP;1506;443  >  62859 [ACK] Seq=4357 Ack=289 Win=16776192 Len=1452 [TCP segment of a reassembled PDU];;;0.435906;0.435958;5.2E-05;-2.8E-05;8E-05;0.000108
19;0.435958;192.168.1.7;40.126.16.166;TCP;54;62859  >  443 [ACK] Seq=289 Ack=5809 Win=66048 Len=0;;;0.435958;0.436038;8E-05;-0.006503;0.006583;0.013086
20;0.436038;40.126.16.166;192.168.1.7;TLSv1.2;706;Server Hello, Certificate, Certificate Status, Server Key Exchange, Server Hello Done;;;0.436038;0.442621;0.006583;-0.087309;0.093892;0.181201
21;0.442621;192.168.1.7;40.126.16.166;TLSv1.2;212;Client Key Exchange, Change Cipher Spec, Encrypted Handshake Message;;;0.442621;0.536513;0.093892;0.093043;0.000849;-0.092194
26;0.536513;40.126.16.166;192.168.1.7;TLSv1.2;105;Change Cipher Spec, Encrypted Handshake Message;;;0.536513;0.537362;0.000849;0.00071;0.000139;-0.000571
27;0.537362;192.168.1.7;40.126.16.166;TLSv1.2;344;Application Data;;;0.537362;0.537501;0.000139;0.000139;0;-0.000139
28;0.537501;192.168.1.7;40.126.16.166;TCP;1494;62859  >  443 [ACK] Seq=737 Ack=6512 Win=65536 Len=1440 [TCP segment of a reassembled PDU];;;0.537501;0.537501;0;0;0;0
29;0.537501;192.168.1.7;40.126.16.166;TCP;1494;62859  >  443 [ACK] Seq=2177 Ack=6512 Win=65536 Len=1440 [TCP segment of a reassembled PDU];;;0.537501;0.537501;0;0;0;0
30;0.537501;192.168.1.7;40.126.16.166;TCP;1494;62859  >  443 [ACK] Seq=3617 Ack=6512 Win=65536 Len=1440 [TCP segment of a reassembled PDU];;;0.537501;0.537501;0;0;0;0
31;0.537501;192.168.1.7;40.126.16.166;TCP;1494;62859  >  443 [ACK] Seq=5057 Ack=6512 Win=65536 Len=1440 [TCP segment of a reassembled PDU];;;0.537501;0.537501;0;-0.086721;0.086721;0.173442
32;0.537501;192.168.1.7;40.126.16.166;TLSv1.2;794;Application Data;;;0.537501;0.624222;0.086721;0.085777;0.000944;-0.084833
41;0.624222;40.126.16.166;192.168.1.7;TCP;56;443  >  62859 [ACK] Seq=6512 Ack=2177 Win=16776192 Len=0;;;0.624222;0.625166;0.000944;-0.000846;0.00179;0.002636
42;0.625166;40.126.16.166;192.168.1.7;TCP;56;443  >  62859 [ACK] Seq=6512 Ack=5057 Win=16776192 Len=0;;;0.625166;0.626956;0.00179;-0.154242;0.156032;0.310274
43;0.626956;40.126.16.166;192.168.1.7;TCP;56;443  >  62859 [ACK] Seq=6512 Ack=7237 Win=16776192 Len=0;;;0.626956;0.782988;0.156032;0.15584;0.000192;-0.155648
44;0.782988;40.126.16.166;192.168.1.7;TCP;1506;443  >  62859 [ACK] Seq=6512 Ack=7237 Win=16776192 Len=1452 [TCP segment of a reassembled PDU];;;0.782988;0.78318;0.000192;0.000116;7.6E-05;-4E-05
45;0.78318;40.126.16.166;192.168.1.7;TCP;1506;443  >  62859 [ACK] Seq=7964 Ack=7237 Win=16776192 Len=1452 [TCP segment of a reassembled PDU];;;0.78318;0.783256;7.6E-05;-4.4E-05;0.00012;0.000164
46;0.783256;192.168.1.7;40.126.16.166;TCP;54;62859  >  443 [ACK] Seq=7237 Ack=9416 Win=66048 Len=0;;;0.783256;0.783376;0.00012;-0.000176;0.000296;0.000472
47;0.783376;40.126.16.166;192.168.1.7;TCP;1506;443  >  62859 [ACK] Seq=9416 Ack=7237 Win=16776192 Len=1452 [TCP segment of a reassembled PDU];;;0.783376;0.783672;0.000296;0.000243;5.3E-05;-0.00019
48;0.783672;40.126.16.166;192.168.1.7;TCP;1506;443  >  62859 [ACK] Seq=10868 Ack=7237 Win=16776192 Len=1452 [TCP segment of a reassembled PDU];;;0.783672;0.783725;5.3E-05;-0.000128;0.000181;0.000309
49;0.783725;192.168.1.7;40.126.16.166;TCP;54;62859  >  443 [ACK] Seq=7237 Ack=12320 Win=66048 Len=0;;;0.783725;0.783906;0.000181;-0.000129;0.00031;0.000439
50;0.783906;40.126.16.166;192.168.1.7;TCP;1506;443  >  62859 [ACK] Seq=12320 Ack=7237 Win=16776192 Len=1452 [TCP segment of a reassembled PDU];;;0.783906;0.784216;0.00031;0.000251;5.9E-05;-0.000192
51;0.784216;40.126.16.166;192.168.1.7;TCP;1506;443  >  62859 [ACK] Seq=13772 Ack=7237 Win=16776192 Len=1452 [TCP segment of a reassembled PDU];;;0.784216;0.784275;5.9E-05;-0.000208;0.000267;0.000475
52;0.784275;192.168.1.7;40.126.16.166;TCP;54;62859  >  443 [ACK] Seq=7237 Ack=15224 Win=66048 Len=0;;;0.784275;0.784542;0.000267;-4.3E-05;0.00031;0.000353
53;0.784542;40.126.16.166;192.168.1.7;TCP;1506;443  >  62859 [ACK] Seq=15224 Ack=7237 Win=16776192 Len=1452 [TCP segment of a reassembled PDU];;;0.784542;0.784852;0.00031;0.00026;5E-05;-0.00021
54;0.784852;40.126.16.166;192.168.1.7;TCP;1506;443  >  62859 [ACK] Seq=16676 Ack=7237 Win=16776192 Len=1452 [TCP segment of a reassembled PDU];;;0.784852;0.784902;5E-05;-0.000181;0.000231;0.000412
55;0.784902;192.168.1.7;40.126.16.166;TCP;54;62859  >  443 [ACK] Seq=7237 Ack=18128 Win=66048 Len=0;;;0.784902;0.785133;0.000231;-9.9E-05;0.00033;0.000429
56;0.785133;40.126.16.166;192.168.1.7;TCP;1506;443  >  62859 [ACK] Seq=18128 Ack=7237 Win=16776192 Len=1452 [TCP segment of a reassembled PDU];;;0.785133;0.785463;0.00033;0.000288;4.2E-05;-0.000246
57;0.785463;40.126.16.166;192.168.1.7;TCP;1506;443  >  62859 [ACK] Seq=19580 Ack=7237 Win=16776192 Len=1452 [TCP segment of a reassembled PDU];;;0.785463;0.785505;4.2E-05;-0.000217;0.000259;0.000476
58;0.785505;192.168.1.7;40.126.16.166;TCP;54;62859  >  443 [ACK] Seq=7237 Ack=21032 Win=66048 Len=0;;;0.785505;0.785764;0.000259;3.9E-05;0.00022;0.000181
59;0.785764;40.126.16.166;192.168.1.7;TCP;1506;443  >  62859 [ACK] Seq=21032 Ack=7237 Win=16776192 Len=1452 [TCP segment of a reassembled PDU];;;0.785764;0.785984;0.00022;0.000166;5.4E-05;-0.000112
60;0.785984;40.126.16.166;192.168.1.7;TLSv1.2;852;Application Data, Application Data;;;0.785984;0.786038;5.4E-05;-0.000471;0.000525;0.000996
61;0.786038;192.168.1.7;40.126.16.166;TCP;54;62859  >  443 [ACK] Seq=7237 Ack=23283 Win=66048 Len=0;;;0.786038;0.786563;0.000525;0.000454;7.1E-05;-0.000383
62;0.786563;192.168.1.7;40.126.16.166;TLSv1.2;85;Encrypted Alert;;;0.786563;0.786634;7.1E-05;-0.085888;0.085959;0.171847
63;0.786634;192.168.1.7;40.126.16.166;TCP;54;62859  >  443 [FIN, ACK] Seq=7268 Ack=23283 Win=66048 Len=0;;;0.786634;0.872593;0.085959;-0.248918;0.334877;0.583795
64;0.872593;40.126.16.166;192.168.1.7;TCP;54;443  >  62859 [ACK] Seq=23283 Ack=7269 Win=16776192 Len=0;;;0.872593;1.20747;0.334877;0.281569;0.053308;-0.228261
67;1.20747;192.168.1.7;20.205.146.149;TCP;66;62860  >  443 [SYN] Seq=0 Win=64240 Len=0 MSS=1460 WS=256 SACK_PERM=1;;;1.20747;1.260778;0.053308;0.053053;0.000255;-0.052798
68;1.260778;20.205.146.149;192.168.1.7;TCP;66;443  >  62860 [SYN, ACK] Seq=0 Ack=1 Win=64240 Len=0 MSS=1440 SACK_PERM=1 WS=128;;;1.260778;1.261033;0.000255;-0.004467;0.004722;0.009189
69;1.261033;192.168.1.7;20.205.146.149;TCP;54;62860  >  443 [ACK] Seq=1 Ack=1 Win=66048 Len=0;;;1.261033;1.265755;0.004722;-0.019134;0.023856;0.04299
70;1.265755;192.168.1.7;20.205.146.149;TLSv1.3;354;Client Hello;;;1.265755;1.289611;0.023856;0.010695;0.013161;0.002466
71;1.289611;20.205.146.149;192.168.1.7;TCP;54;443  >  62860 [ACK] Seq=1 Ack=301 Win=64128 Len=0;;;1.289611;1.302772;0.013161;0.01283;0.000331;-0.012499
72;1.302772;20.205.146.149;192.168.1.7;TLSv1.3;1506;Server Hello, Change Cipher Spec, Application Data;;;1.302772;1.303103;0.000331;0.000268;6.3E-05;-0.000205
73;1.303103;20.205.146.149;192.168.1.7;TCP;1506;443  >  62860 [PSH, ACK] Seq=1453 Ack=301 Win=64128 Len=1452 [TCP segment of a reassembled PDU];;;1.303103;1.303166;6.3E-05;-0.0003;0.000363;0.000663
74;1.303166;192.168.1.7;20.205.146.149;TCP;54;62860  >  443 [ACK] Seq=301 Ack=2905 Win=66048 Len=0;;;1.303166;1.303529;0.000363;-0.010193;0.010556;0.020749
75;1.303529;20.205.146.149;192.168.1.7;TLSv1.3;1454;Application Data, Application Data, Application Data;;;1.303529;1.314085;0.010556;-0.007362;0.017918;0.02528
76;1.314085;192.168.1.7;20.205.146.149;TLSv1.3;134;Change Cipher Spec, Application Data;;;1.314085;1.332003;0.017918;0.017567;0.000351;-0.017216
77;1.332003;192.168.1.7;20.205.146.149;TLSv1.3;134;Application Data;;;1.332003;1.332354;0.000351;-3.9E-05;0.00039;0.000429
78;1.332354;192.168.1.7;20.205.146.149;TLSv1.3;1489;Application Data;;;1.332354;1.332744;0.00039;0.00039;0;-0.00039
79;1.332744;192.168.1.7;20.205.146.149;TCP;1494;62860  >  443 [ACK] Seq=1896 Ack=4305 Win=64768 Len=1440 [TCP segment of a reassembled PDU];;;1.332744;1.332744;0;-0.040557;0.040557;0.081114
80;1.332744;192.168.1.7;20.205.146.149;TLSv1.3;753;Application Data;;;1.332744;1.373301;0.040557;0.040331;0.000226;-0.040105
81;1.373301;20.205.146.149;192.168.1.7;TCP;56;443  >  62860 [ACK] Seq=4305 Ack=381 Win=64128 Len=0;;;1.373301;1.373527;0.000226;8.4E-05;0.000142;5.8E-05
82;1.373527;20.205.146.149;192.168.1.7;TLSv1.3;564;Application Data, Application Data;;;1.373527;1.373669;0.000142;-0.001349;0.001491;0.00284
83;1.373669;192.168.1.7;20.205.146.149;TCP;54;62860  >  443 [ACK] Seq=4035 Ack=4815 Win=66048 Len=0;;;1.373669;1.37516;0.001491;0.001402;8.9E-05;-0.001313
84;1.37516;20.205.146.149;192.168.1.7;TCP;56;443  >  62860 [ACK] Seq=4815 Ack=461 Win=64128 Len=0;;;1.37516;1.375249;8.9E-05;2.1E-05;6.8E-05;4.7E-05
85;1.375249;20.205.146.149;192.168.1.7;TLSv1.3;169;Application Data, Application Data, Application Data;;;1.375249;1.375317;6.8E-05;-2.9E-05;9.7E-05;0.000126
86;1.375317;192.168.1.7;20.205.146.149;TCP;54;62860  >  443 [ACK] Seq=4035 Ack=4930 Win=66048 Len=0;;;1.375317;1.375414;9.7E-05;-0.00543;0.005527;0.010957
87;1.375414;20.205.146.149;192.168.1.7;TCP;56;443  >  62860 [ACK] Seq=4930 Ack=3336 Win=64128 Len=0;;;1.375414;1.380941;0.005527;-0.01585;0.021377;0.037227
88;1.380941;192.168.1.7;20.205.146.149;TLSv1.3;85;Application Data;;;1.380941;1.402318;0.021377;0.021228;0.000149;-0.021079
89;1.402318;20.205.146.149;192.168.1.7;TLSv1.3;1506;Application Data;;;1.402318;1.402467;0.000149;4.6E-05;0.000103;5.7E-05
90;1.402467;192.168.1.7;20.205.146.149;TCP;54;62860  >  443 [ACK] Seq=4066 Ack=6382 Win=66048 Len=0;;;1.402467;1.40257;0.000103;5.2E-05;5.1E-05;-1E-06
91;1.40257;20.205.146.149;192.168.1.7;TLSv1.3;1506;Application Data [TCP segment of a reassembled PDU];;;1.40257;1.402621;5.1E-05;-0.000172;0.000223;0.000395
92;1.402621;192.168.1.7;20.205.146.149;TCP;54;62860  >  443 [ACK] Seq=4066 Ack=7834 Win=66048 Len=0;;;1.402621;1.402844;0.000223;0.000178;4.5E-05;-0.000133
93;1.402844;20.205.146.149;192.168.1.7;TLSv1.3;1506;Application Data [TCP segment of a reassembled PDU];;;1.402844;1.402889;4.5E-05;-0.000859;0.000904;0.001763
94;1.402889;192.168.1.7;20.205.146.149;TCP;54;62860  >  443 [ACK] Seq=4066 Ack=9286 Win=66048 Len=0;;;1.402889;1.403793;0.000904;0.000847;5.7E-05;-0.00079
95;1.403793;20.205.146.149;192.168.1.7;TLSv1.3;984;Application Data, Application Data, Application Data;;;1.403793;1.40385;5.7E-05;-0.001094;0.001151;0.002245
96;1.40385;192.168.1.7;20.205.146.149;TCP;54;62860  >  443 [ACK] Seq=4066 Ack=10216 Win=65280 Len=0;;;1.40385;1.405001;0.001151;-0.023325;0.024476;0.047801
97;1.405001;192.168.1.7;20.205.146.149;TCP;54;62860  >  443 [FIN, ACK] Seq=4066 Ack=10216 Win=65280 Len=0;;;1.405001;1.429477;0.024476;0.024337;0.000139;-0.024198
98;1.429477;20.205.146.149;192.168.1.7;TCP;54;443  >  62860 [FIN, ACK] Seq=10216 Ack=4067 Win=64128 Len=0;;;1.429477;1.429616;0.000139;-2.000569;2.000708;4.001277
99;1.429616;192.168.1.7;20.205.146.149;TCP;54;62860  >  443 [ACK] Seq=4067 Ack=10217 Win=65280 Len=0;;;1.429616;3.430324;2.000708;1.973174;0.027534;-1.94564
100;3.430324;192.168.1.7;20.197.71.89;TLSv1.2;98;Application Data;;;3.430324;3.457858;0.027534;-0.023471;0.051005;0.074476
101;3.457858;20.197.71.89;192.168.1.7;TLSv1.2;229;Application Data;;;3.457858;3.508863;0.051005;-0.728373;0.779378;1.507751
161;3.508863;192.168.1.7;20.197.71.89;TCP;54;49730  >  443 [ACK] Seq=45 Ack=176 Win=258 Len=0;;;3.508863;4.288241;0.779378;0.562532;0.216846;-0.345686
571;4.288241;192.168.1.7;52.109.8.21;TCP;66;62861  >  443 [SYN] Seq=0 Win=64240 Len=0 MSS=1460 WS=256 SACK_PERM=1;;;4.288241;4.505087;0.216846;0.216642;0.000204;-0.216438
572;4.505087;52.109.8.21;192.168.1.7;TCP;66;443  >  62861 [SYN, ACK] Seq=0 Ack=1 Win=65535 Len=0 MSS=1440 WS=256 SACK_PERM=1;;;4.505087;4.505291;0.000204;-0.001191;0.001395;0.002586
573;4.505291;192.168.1.7;52.109.8.21;TCP;54;62861  >  443 [ACK] Seq=1 Ack=1 Win=66048 Len=0;;;4.505291;4.506686;0.001395;-0.217084;0.218479;0.435563
574;4.506686;192.168.1.7;52.109.8.21;TLSv1.2;267;Client Hello;;;4.506686;4.725165;0.218479;0.218313;0.000166;-0.218147
575;4.725165;52.109.8.21;192.168.1.7;TCP;1506;443  >  62861 [ACK] Seq=1 Ack=214 Win=525312 Len=1452 [TCP segment of a reassembled PDU];;;4.725165;4.725331;0.000166;0.000122;4.4E-05;-7.8E-05
576;4.725331;52.109.8.21;192.168.1.7;TCP;1506;443  >  62861 [ACK] Seq=1453 Ack=214 Win=525312 Len=1452 [TCP segment of a reassembled PDU];;;4.725331;4.725375;4.4E-05;-0.000349;0.000393;0.000742
577;4.725375;192.168.1.7;52.109.8.21;TCP;54;62861  >  443 [ACK] Seq=214 Ack=2905 Win=66048 Len=0;;;4.725375;4.725768;0.000393;0.000225;0.000168;-5.7E-05
578;4.725768;52.109.8.21;192.168.1.7;TCP;1506;443  >  62861 [ACK] Seq=2905 Ack=214 Win=525312 Len=1452 [TCP segment of a reassembled PDU];;;4.725768;4.725936;0.000168;0.000124;4.4E-05;-8E-05
579;4.725936;52.109.8.21;192.168.1.7;TCP;1506;443  >  62861 [ACK] Seq=4357 Ack=214 Win=525312 Len=1452 [TCP segment of a reassembled PDU];;;4.725936;4.72598;4.4E-05;-0.00011;0.000154;0.000264
580;4.72598;192.168.1.7;52.109.8.21;TCP;54;62861  >  443 [ACK] Seq=214 Ack=5809 Win=66048 Len=0;;;4.72598;4.726134;0.000154;-0.011062;0.011216;0.022278
581;4.726134;52.109.8.21;192.168.1.7;TLSv1.2;58;Server Hello, Certificate, Certificate Status, Server Key Exchange, Server Hello Done;;;4.726134;4.73735;0.011216;-0.205374;0.21659;0.421964
582;4.73735;192.168.1.7;52.109.8.21;TLSv1.2;212;Client Key Exchange, Change Cipher Spec, Encrypted Handshake Message;;;4.73735;4.95394;0.21659;0.216422;0.000168;-0.216254
583;4.95394;52.109.8.21;192.168.1.7;TLSv1.2;105;Change Cipher Spec, Encrypted Handshake Message;;;4.95394;4.954108;0.000168;0.000119;4.9E-05;-7E-05
584;4.954108;52.109.8.21;192.168.1.7;TLSv1.2;123;Application Data;;;4.954108;4.954157;4.9E-05;-0.012642;0.012691;0.025333
585;4.954157;192.168.1.7;52.109.8.21;TCP;54;62861  >  443 [ACK] Seq=372 Ack=5933 Win=66048 Len=0;;;4.954157;4.966848;0.012691;0.012246;0.000445;-0.011801
586;4.966848;192.168.1.7;52.109.8.21;TLSv1.2;141;Application Data;;;4.966848;4.967293;0.000445;0.000268;0.000177;-9.1E-05
587;4.967293;192.168.1.7;52.109.8.21;TLSv1.2;483;Application Data;;;4.967293;4.96747;0.000177;-0.225319;0.225496;0.450815
588;4.96747;192.168.1.7;52.109.8.21;TLSv1.2;92;Application Data;;;4.96747;5.192966;0.225496;0.225215;0.000281;-0.224934
589;5.192966;52.109.8.21;192.168.1.7;TCP;56;443  >  62861 [ACK] Seq=5933 Ack=926 Win=524544 Len=0;;;5.192966;5.193247;0.000281;4.1E-05;0.00024;0.000199
590;5.193247;52.109.8.21;192.168.1.7;TLSv1.2;92;Application Data;;;5.193247;5.193487;0.00024;0.000179;6.1E-05;-0.000118
591;5.193487;52.109.8.21;192.168.1.7;TLSv1.2;306;Application Data;;;5.193487;5.193548;6.1E-05;-3.456662;3.456723;6.913385
592;5.193548;192.168.1.7;52.109.8.21;TCP;54;62861  >  443 [ACK] Seq=926 Ack=6223 Win=65792 Len=0;;;5.193548;8.650271;3.456723;3.423571;0.033152;-3.390419
2079;8.650271;192.168.1.7;74.125.130.94;TCP;55;62851  >  80 [ACK] Seq=1 Ack=1 Win=251 Len=1;;;8.650271;8.683423;0.033152;-0.036837;0.069989;0.106826
2168;8.683423;192.168.1.7;74.125.130.94;TCP;55;62852  >  80 [ACK] Seq=1 Ack=1 Win=254 Len=1;;;8.683423;8.753412;0.069989;0.064763;0.005226;-0.059537
2410;8.753412;74.125.130.94;192.168.1.7;TCP;66;80  >  62851 [ACK] Seq=1 Ack=2 Win=265 Len=0 SLE=1 SRE=2;;;8.753412;8.758638;0.005226;-0.931783;0.937009;1.868792
2439;8.758638;74.125.130.94;192.168.1.7;TCP;66;80  >  62852 [ACK] Seq=1 Ack=2 Win=261 Len=0 SLE=1 SRE=2;;;8.758638;9.695647;0.937009;0.891857;0.045152;-0.846705
2541;9.695647;157.240.218.60;192.168.1.7;TLSv1.2;303;Application Data;;;9.695647;9.740799;0.045152;-0.653286;0.698438;1.351724
2542;9.740799;192.168.1.7;157.240.218.60;TCP;54;62691  >  443 [ACK] Seq=1 Ack=250 Win=257 Len=0;;;9.740799;10.439237;0.698438;0.676522;0.021916;-0.654606
2554;10.439237;192.168.1.7;35.197.154.200;TCP;55;[TCP Keep-Alive] 62843  >  443 [ACK] Seq=1 Ack=1 Win=260 Len=1;;;10.439237;10.461153;0.021916;-4.167175;4.189091;8.356266
2555;10.461153;35.197.154.200;192.168.1.7;TCP;66;[TCP Keep-Alive ACK] 443  >  62843 [ACK] Seq=1 Ack=2 Win=139 Len=0 SLE=1 SRE=2;;;10.461153;14.650244;4.189091;4.167492;0.021599;-4.145893
2556;14.650244;192.168.1.7;172.253.118.94;TLSv1.2;93;Application Data;;;14.650244;14.671843;0.021599;-0.027878;0.049477;0.077355
2557;14.671843;172.253.118.94;192.168.1.7;TLSv1.2;93;Application Data;;;14.671843;14.72132;0.049477;-3.377939;3.427416;6.805355
2558;14.72132;192.168.1.7;172.253.118.94;TCP;54;62839  >  443 [ACK] Seq=40 Ack=40 Win=253 Len=0;;;14.72132;18.148736;3.427416;3.203167;0.224249;-2.978918
2569;18.148736;192.168.1.7;13.89.179.10;TCP;54;62830  >  443 [FIN, ACK] Seq=1 Ack=1 Win=1020 Len=0;;;18.148736;18.372985;0.224249;0.224065;0.000184;-0.223881
2570;18.372985;13.89.179.10;192.168.1.7;TCP;54;443  >  62830 [FIN, ACK] Seq=1 Ack=2 Win=2047 Len=0;;;18.372985;18.373169;0.000184;-0.387382;0.387566;0.774948
2571;18.373169;192.168.1.7;13.89.179.10;TCP;54;62830  >  443 [ACK] Seq=2 Ack=2 Win=1020 Len=0;;;18.373169;18.760735;0.387566;0.387566;0;-0.387566
2572;18.760735;192.168.1.7;74.125.130.94;TCP;55;[TCP Keep-Alive] 62851  >  80 [ACK] Seq=1 Ack=1 Win=251 Len=1;;;18.760735;18.760735;0;-0.019584;0.019584;0.039168
2573;18.760735;192.168.1.7;74.125.130.94;TCP;55;[TCP Keep-Alive] 62852  >  80 [ACK] Seq=1 Ack=1 Win=254 Len=1;;;18.760735;18.780319;0.019584;0.016549;0.003035;-0.013514
2574;18.780319;74.125.130.94;192.168.1.7;TCP;66;[TCP Keep-Alive ACK] 80  >  62851 [ACK] Seq=1 Ack=2 Win=265 Len=0 SLE=1 SRE=2;;;18.780319;18.783354;0.003035;-1.675597;1.678632;3.354229
2575;18.783354;74.125.130.94;192.168.1.7;TCP;66;[TCP Keep-Alive ACK] 80  >  62852 [ACK] Seq=1 Ack=2 Win=261 Len=0 SLE=1 SRE=2;;;18.783354;20.461986;1.678632;1.643927;0.034705;-1.609222
3073;20.461986;192.168.1.7;35.197.154.200;TCP;55;[TCP Keep-Alive] 62843  >  443 [ACK] Seq=1 Ack=1 Win=260 Len=1;;;20.461986;20.496691;0.034705;-0.52967;0.564375;1.094045
3074;20.496691;35.197.154.200;192.168.1.7;TCP;66;[TCP Keep-Alive ACK] 443  >  62843 [ACK] Seq=1 Ack=2 Win=139 Len=0 SLE=1 SRE=2;;;20.496691;21.061066;0.564375;0.542012;0.022363;-0.519649
3083;21.061066;192.168.1.7;35.186.224.39;TLSv1.2;97;Application Data;;;21.061066;21.083429;0.022363;-0.039118;0.061481;0.100599
3085;21.083429;35.186.224.39;192.168.1.7;TCP;56;443  >  49752 [ACK] Seq=1 Ack=44 Win=272 Len=0;;;21.083429;21.14491;0.061481;0.00651;0.054971;0.048461
3086;21.14491;35.186.224.39;192.168.1.7;TLSv1.2;94;Application Data;;;21.14491;21.199881;0.054971;-0.230638;0.285609;0.516247
3087;21.199881;192.168.1.7;35.186.224.39;TCP;54;49752  >  443 [ACK] Seq=44 Ack=41 Win=252 Len=0;;;21.199881;21.48549;0.285609;0.247301;0.038308;-0.208993
3088;21.48549;192.168.1.7;35.186.224.47;TLSv1.2;89;Application Data;;;21.48549;21.523798;0.038308;-0.002836;0.041144;0.04398
3089;21.523798;35.186.224.47;192.168.1.7;TCP;56;443  >  49748 [ACK] Seq=1 Ack=36 Win=266 Len=0;;;21.523798;21.564942;0.041144;0.001521;0.039623;0.038102
3090;21.564942;35.186.224.47;192.168.1.7;TLSv1.2;85;Application Data;;;21.564942;21.604565;0.039623;-0.009562;0.049185;0.058747
3091;21.604565;192.168.1.7;35.186.224.47;TCP;54;49748  >  443 [ACK] Seq=36 Ack=32 Win=255 Len=0;;;21.604565;21.65375;0.049185;0.048761;0.000424;-0.048337
3092;21.65375;192.168.1.7;142.251.12.93;TLSv1.2;93;Application Data;;;21.65375;21.654174;0.000424;-0.019691;0.020115;0.039806
3093;21.654174;192.168.1.7;142.251.12.106;TLSv1.2;93;Application Data;;;21.654174;21.674289;0.020115;0.019901;0.000214;-0.019687
3094;21.674289;142.251.12.106;192.168.1.7;TLSv1.2;93;Application Data;;;21.674289;21.674503;0.000214;0.000109;0.000105;-4E-06
3095;21.674503;142.251.12.93;192.168.1.7;TLSv1.2;93;Application Data;;;21.674503;21.674608;0.000105;5.9E-05;4.6E-05;-1.3E-05
3096;21.674608;142.251.12.106;192.168.1.7;TCP;56;443  >  62844 [ACK] Seq=1 Ack=40 Win=284 Len=0;;;21.674608;21.674654;4.6E-05;-4.2E-05;8.8E-05;0.00013
3097;21.674654;192.168.1.7;142.251.12.106;TCP;54;62844  >  443 [ACK] Seq=40 Ack=40 Win=252 Len=0;;;21.674654;21.674742;8.8E-05;6E-05;2.8E-05;-3.2E-05
3098;21.674742;142.251.12.93;192.168.1.7;TCP;56;443  >  62842 [ACK] Seq=1 Ack=40 Win=265 Len=0;;;21.674742;21.67477;2.8E-05;-2.560272;2.5603;5.120572
3099;21.67477;192.168.1.7;142.251.12.93;TCP;54;62842  >  443 [ACK] Seq=40 Ack=40 Win=256 Len=0;;;21.67477;24.23507;2.5603;2.505998;0.054302;-2.451696
3102;24.23507;104.199.240.237;192.168.1.7;TCP;65;4070  >  49739 [PSH, ACK] Seq=1 Ack=1 Win=16 Len=11;;;24.23507;24.289372;0.054302;-0.850559;0.904861;1.75542
3103;24.289372;192.168.1.7;104.199.240.237;TCP;54;49739  >  4070 [ACK] Seq=1 Ack=12 Win=253 Len=0;;;24.289372;25.194233;0.904861;0.872759;0.032102;-0.840657
3106;25.194233;192.168.1.7;35.186.224.25;TCP;66;62862  >  443 [SYN] Seq=0 Win=64240 Len=0 MSS=1460 WS=256 SACK_PERM=1;;;25.194233;25.226335;0.032102;0.03191;0.000192;-0.031718
3107;25.226335;35.186.224.25;192.168.1.7;TCP;66;443  >  62862 [SYN, ACK] Seq=0 Ack=1 Win=65535 Len=0 MSS=1430 SACK_PERM=1 WS=256;;;25.226335;25.226527;0.000192;-0.000567;0.000759;0.001326
3108;25.226527;192.168.1.7;35.186.224.25;TCP;54;62862  >  443 [ACK] Seq=1 Ack=1 Win=65536 Len=0;;;25.226527;25.227286;0.000759;-0.044309;0.045068;0.089377
3109;25.227286;192.168.1.7;35.186.224.25;TLSv1.3;571;Client Hello;;;25.227286;25.272354;0.045068;0.044915;0.000153;-0.044762
3110;25.272354;35.186.224.25;192.168.1.7;TCP;54;443  >  62862 [ACK] Seq=1 Ack=518 Win=66816 Len=0;;;25.272354;25.272507;0.000153;5.7E-05;9.6E-05;3.9E-05
3111;25.272507;35.186.224.25;192.168.1.7;TLSv1.3;1484;Server Hello, Change Cipher Spec;;;25.272507;25.272603;9.6E-05;4.8E-05;4.8E-05;0
3112;25.272603;35.186.224.25;192.168.1.7;TCP;1484;443  >  62862 [PSH, ACK] Seq=1431 Ack=518 Win=66816 Len=1430 [TCP segment of a reassembled PDU];;;25.272603;25.272651;4.8E-05;-0.000146;0.000194;0.00034
3113;25.272651;192.168.1.7;35.186.224.25;TCP;54;62862  >  443 [ACK] Seq=518 Ack=2861 Win=65536 Len=0;;;25.272651;25.272845;0.000194;-0.000988;0.001182;0.00217
3114;25.272845;35.186.224.25;192.168.1.7;TLSv1.3;654;Application Data;;;25.272845;25.274027;0.001182;0.000632;0.00055;-8.2E-05
3115;25.274027;192.168.1.7;35.186.224.25;TLSv1.3;118;Change Cipher Spec, Application Data;;;25.274027;25.274577;0.00055;0.000161;0.000389;0.000228
3116;25.274577;192.168.1.7;35.186.224.25;TLSv1.3;146;Application Data;;;25.274577;25.274966;0.000389;0.000247;0.000142;-0.000105
3117;25.274966;192.168.1.7;35.186.224.25;TLSv1.3;844;Application Data;;;25.274966;25.275108;0.000142;0.000142;0;-0.000142
3118;25.275108;192.168.1.7;35.186.224.25;TCP;1484;62862  >  443 [ACK] Seq=1464 Ack=3461 Win=65024 Len=1430 [TCP segment of a reassembled PDU];;;25.275108;25.275108;0;-0.024722;0.024722;0.049444
3119;25.275108;192.168.1.7;35.186.224.25;TLSv1.3;155;Application Data;;;25.275108;25.29983;0.024722;0.024598;0.000124;-0.024474
3120;25.29983;35.186.224.25;192.168.1.7;TCP;56;443  >  62862 [ACK] Seq=3461 Ack=1464 Win=68352 Len=0;;;25.29983;25.299954;0.000124;-0.000278;0.000402;0.00068
3121;25.299954;35.186.224.25;192.168.1.7;TLSv1.3;634;Application Data, Application Data;;;25.299954;25.300356;0.000402;-0.000311;0.000713;0.001024
3122;25.300356;192.168.1.7;35.186.224.25;TLSv1.3;85;Application Data;;;25.300356;25.301069;0.000713;-0.003836;0.004549;0.008385
3123;25.301069;35.186.224.25;192.168.1.7;TLSv1.3;85;Application Data;;;25.301069;25.305618;0.004549;-0.028634;0.033183;0.061817
3124;25.305618;35.186.224.25;192.168.1.7;TCP;56;443  >  62862 [ACK] Seq=4072 Ack=2995 Win=71168 Len=0;;;25.305618;25.338801;0.033183;0.030029;0.003154;-0.026875
3125;25.338801;35.186.224.25;192.168.1.7;TCP;56;443  >  62862 [ACK] Seq=4072 Ack=3026 Win=71168 Len=0;;;25.338801;25.341955;0.003154;-0.087431;0.090585;0.178016
3126;25.341955;192.168.1.7;35.186.224.25;TCP;54;62862  >  443 [ACK] Seq=3026 Ack=4072 Win=64512 Len=0;;;25.341955;25.43254;0.090585;0.090257;0.000328;-0.089929
3127;25.43254;35.186.224.25;192.168.1.7;TLSv1.3;500;Application Data;;;25.43254;25.432868;0.000328;0.000271;5.7E-05;-0.000214
3128;25.432868;35.186.224.25;192.168.1.7;TLSv1.3;570;Application Data, Application Data;;;25.432868;25.432925;5.7E-05;-0.000316;0.000373;0.000689
3129;25.432925;192.168.1.7;35.186.224.25;TCP;54;62862  >  443 [ACK] Seq=3026 Ack=5034 Win=65536 Len=0;;;25.432925;25.433298;0.000373;-0.000434;0.000807;0.001241
3130;25.433298;35.186.224.25;192.168.1.7;TLSv1.3;93;Application Data;;;25.433298;25.434105;0.000807;-0.037606;0.038413;0.076019
3131;25.434105;192.168.1.7;35.186.224.25;TLSv1.3;93;Application Data;;;25.434105;25.472518;0.038413;-1.642976;1.681389;3.324365
3132;25.472518;35.186.224.25;192.168.1.7;TCP;56;443  >  62862 [ACK] Seq=5073 Ack=3065 Win=71168 Len=0;;;25.472518;27.153907;1.681389;1.633935;0.047454;-1.586481
3134;27.153907;157.240.218.60;192.168.1.7;TLSv1.2;165;Application Data;;;27.153907;27.201361;0.047454;-1.543636;1.59109;3.134726
3135;27.201361;192.168.1.7;157.240.218.60;TCP;54;62691  >  443 [ACK] Seq=1 Ack=361 Win=256 Len=0;;;27.201361;28.792451;1.59109;1.59109;0;-1.59109
3136;28.792451;192.168.1.7;74.125.130.94;TCP;55;[TCP Keep-Alive] 62851  >  80 [ACK] Seq=1 Ack=1 Win=251 Len=1;;;28.792451;28.792451;0;-0.020194;0.020194;0.040388
3137;28.792451;192.168.1.7;74.125.130.94;TCP;55;[TCP Keep-Alive] 62852  >  80 [ACK] Seq=1 Ack=1 Win=254 Len=1;;;28.792451;28.812645;0.020194;0.017761;0.002433;-0.015328
3138;28.812645;74.125.130.94;192.168.1.7;TCP;66;[TCP Keep-Alive ACK] 80  >  62851 [ACK] Seq=1 Ack=2 Win=265 Len=0 SLE=1 SRE=2;;;28.812645;28.815078;0.002433;-0.678268;0.680701;1.358969
3139;28.815078;74.125.130.94;192.168.1.7;TCP;66;[TCP Keep-Alive ACK] 80  >  62852 [ACK] Seq=1 Ack=2 Win=261 Len=0 SLE=1 SRE=2;;;28.815078;29.495779;0.680701;0.428005;0.252696;-0.175309
3140;29.495779;192.168.1.7;52.239.198.228;TCP;54;62825  >  443 [FIN, ACK] Seq=1 Ack=1 Win=257 Len=0;;;29.495779;29.748475;0.252696;0.252357;0.000339;-0.252018
3141;29.748475;52.239.198.228;192.168.1.7;TCP;54;443  >  62825 [FIN, ACK] Seq=1 Ack=2 Win=2053 Len=0;;;29.748475;29.748814;0.000339;-0.754488;0.754827;1.509315
3142;29.748814;192.168.1.7;52.239.198.228;TCP;54;62825  >  443 [ACK] Seq=2 Ack=2 Win=257 Len=0;;;29.748814;30.503641;0.754827;0.728099;0.026728;-0.701371
3145;30.503641;192.168.1.7;35.197.154.200;TCP;55;[TCP Keep-Alive] 62843  >  443 [ACK] Seq=1 Ack=1 Win=260 Len=1;;;30.503641;30.530369;0.026728;-2.858609;2.885337;5.743946
3146;30.530369;35.197.154.200;192.168.1.7;TCP;66;[TCP Keep-Alive ACK] 443  >  62843 [ACK] Seq=1 Ack=2 Win=139 Len=0 SLE=1 SRE=2;;;30.530369;33.415706;2.885337;2.859172;0.026165;-2.833007
3147;33.415706;192.168.1.7;35.186.224.25;TCP;54;62862  >  443 [FIN, ACK] Seq=3065 Ack=5073 Win=65536 Len=0;;;33.415706;33.441871;0.026165;0.026025;0.00014;-0.025885
3148;33.441871;35.186.224.25;192.168.1.7;TCP;54;443  >  62862 [FIN, ACK] Seq=5073 Ack=3066 Win=71168 Len=0;;;33.441871;33.442011;0.00014;-4.219305;4.219445;8.43875
3149;33.442011;192.168.1.7;35.186.224.25;TCP;54;62862  >  443 [ACK] Seq=3066 Ack=5074 Win=65536 Len=0;;;33.442011;37.661456;4.219445;4.196905;0.02254;-4.174365
3620;37.661456;192.168.1.7;142.251.10.132;TLSv1.2;93;Application Data;;;37.661456;37.683996;0.02254;0.022341;0.000199;-0.022142
3621;37.683996;142.251.10.132;192.168.1.7;TLSv1.2;93;Application Data;;;37.683996;37.684195;0.000199;0.000151;4.8E-05;-0.000103
3622;37.684195;142.251.10.132;192.168.1.7;TCP;56;443  >  62845 [ACK] Seq=1 Ack=40 Win=292 Len=0;;;37.684195;37.684243;4.8E-05;-0.99797;0.998018;1.995988
3623;37.684243;192.168.1.7;142.251.10.132;TCP;54;62845  >  443 [ACK] Seq=40 Ack=40 Win=512 Len=0;;;37.684243;38.682261;0.998018;0.997503;0.000515;-0.996988
3624;38.682261;192.168.1.7;142.251.10.149;TLSv1.2;93;Application Data;;;38.682261;38.682776;0.000515;-0.028285;0.0288;0.057085
3625;38.682776;192.168.1.7;142.251.12.155;TLSv1.2;93;Application Data;;;38.682776;38.711576;0.0288;0.02846;0.00034;-0.02812
3626;38.711576;142.251.12.155;192.168.1.7;TLSv1.2;93;Application Data;;;38.711576;38.711916;0.00034;0.0003;4E-05;-0.00026
3627;38.711916;142.251.12.155;192.168.1.7;TCP;56;443  >  62855 [ACK] Seq=1 Ack=40 Win=272 Len=0;;;38.711916;38.711956;4E-05;-0.000337;0.000377;0.000714
3628;38.711956;192.168.1.7;142.251.12.155;TCP;54;62855  >  443 [ACK] Seq=40 Ack=40 Win=251 Len=0;;;38.711956;38.712333;0.000377;0.000301;7.6E-05;-0.000225
3629;38.712333;142.251.10.149;192.168.1.7;TLSv1.2;93;Application Data;;;38.712333;38.712409;7.6E-05;5.2E-05;2.4E-05;-2.8E-05
3630;38.712409;142.251.10.149;192.168.1.7;TCP;56;443  >  62854 [ACK] Seq=1 Ack=40 Win=277 Len=0;;;38.712409;38.712433;2.4E-05;-0.10861;0.108634;0.217244
3631;38.712433;192.168.1.7;142.251.10.149;TCP;54;62854  >  443 [ACK] Seq=40 Ack=40 Win=251 Len=0;;;38.712433;38.821067;0.108634;0.108634;0;-0.108634
3632;38.821067;192.168.1.7;74.125.130.94;TCP;55;[TCP Keep-Alive] 62852  >  80 [ACK] Seq=1 Ack=1 Win=254 Len=1;;;38.821067;38.821067;0;-0.019979;0.019979;0.039958
3633;38.821067;192.168.1.7;74.125.130.94;TCP;55;[TCP Keep-Alive] 62851  >  80 [ACK] Seq=1 Ack=1 Win=251 Len=1;;;38.821067;38.841046;0.019979;0.016711;0.003268;-0.013443
3634;38.841046;74.125.130.94;192.168.1.7;TCP;66;[TCP Keep-Alive ACK] 80  >  62851 [ACK] Seq=1 Ack=2 Win=265 Len=0 SLE=1 SRE=2;;;38.841046;38.844314;0.003268;-0.84397;0.847238;1.691208
3635;38.844314;74.125.130.94;192.168.1.7;TCP;66;[TCP Keep-Alive ACK] 80  >  62852 [ACK] Seq=1 Ack=2 Win=261 Len=0 SLE=1 SRE=2;;;38.844314;39.691552;0.847238;0.824502;0.022736;-0.801766
3636;39.691552;192.168.1.7;74.125.24.157;TLSv1.2;93;Application Data;;;39.691552;39.714288;0.022736;0.022376;0.00036;-0.022016
3637;39.714288;74.125.24.157;192.168.1.7;TCP;56;443  >  62846 [ACK] Seq=1 Ack=40 Win=305 Len=0;;;39.714288;39.714648;0.00036;-0.056423;0.056783;0.113206
3638;39.714648;74.125.24.157;192.168.1.7;TLSv1.2;93;Application Data;;;39.714648;39.771431;0.056783;-0.7029;0.759683;1.462583
3639;39.771431;192.168.1.7;74.125.24.157;TCP;54;62846  >  443 [ACK] Seq=40 Ack=40 Win=254 Len=0;;;39.771431;40.531114;0.759683;0.735015;0.024668;-0.710347
3640;40.531114;192.168.1.7;35.197.154.200;TCP;55;[TCP Keep-Alive] 62843  >  443 [ACK] Seq=1 Ack=1 Win=260 Len=1;;;40.531114;40.555782;0.024668;-0.128297;0.152965;0.281262
3641;40.555782;35.197.154.200;192.168.1.7;TCP;66;[TCP Keep-Alive ACK] 443  >  62843 [ACK] Seq=1 Ack=2 Win=139 Len=0 SLE=1 SRE=2;;;40.555782;40.708747;0.152965;0.104394;0.048571;-0.055823
3642;40.708747;192.168.1.7;34.120.208.123;TLSv1.2;100;Application Data;;;40.708747;40.757318;0.048571;0.048458;0.000113;-0.048345
3643;40.757318;34.120.208.123;192.168.1.7;TCP;56;443  >  62857 [ACK] Seq=1 Ack=47 Win=303 Len=0;;;40.757318;40.757431;0.000113;-0.043417;0.04353;0.086947
3644;40.757431;34.120.208.123;192.168.1.7;TLSv1.2;100;Application Data;;;40.757431;40.800961;0.04353;-1.512663;1.556193;3.068856
3645;40.800961;192.168.1.7;34.120.208.123;TCP;54;62857  >  443 [ACK] Seq=47 Ack=47 Win=253 Len=0;;;40.800961;42.357154;1.556193;1.516097;0.040096;-1.476001
3660;42.357154;157.240.218.60;192.168.1.7;TLSv1.2;276;Application Data;;;42.357154;42.39725;0.040096;-0.228189;0.268285;0.496474
3661;42.39725;192.168.1.7;157.240.218.60;TCP;54;62691  >  443 [ACK] Seq=1 Ack=583 Win=256 Len=0;;;42.39725;42.665535;0.268285;0.222497;0.045788;-0.176709
3662;42.665535;157.240.218.60;192.168.1.7;TLSv1.2;276;Application Data;;;42.665535;42.711323;0.045788;-0.146149;0.191937;0.338086
3663;42.711323;192.168.1.7;157.240.218.60;TCP;54;62691  >  443 [ACK] Seq=1 Ack=805 Win=261 Len=0;;;42.711323;42.90326;0.191937;0.144047;0.04789;-0.096157
3664;42.90326;157.240.218.60;192.168.1.7;TLSv1.2;276;Application Data;;;42.90326;42.95115;0.04789;-5.433212;5.481102;10.914314
3665;42.95115;192.168.1.7;157.240.218.60;TCP;54;62691  >  443 [ACK] Seq=1 Ack=1027 Win=260 Len=0;;;42.95115;48.432252;5.481102;5.452109;0.028993;-5.423116
3666;48.432252;192.168.1.7;20.197.71.89;TLSv1.2;98;Application Data;;;48.432252;48.461245;0.028993;-0.024598;0.053591;0.078189
3667;48.461245;20.197.71.89;192.168.1.7;TLSv1.2;229;Application Data;;;48.461245;48.514836;0.053591;-0.283051;0.336642;0.619693
3668;48.514836;192.168.1.7;20.197.71.89;TCP;54;49730  >  443 [ACK] Seq=89 Ack=351 Win=257 Len=0;;;48.514836;48.851478;0.336642;0.336643;-1E-06;-0.336644
3669;48.851478;192.168.1.7;74.125.130.94;TCP;55;[TCP Keep-Alive] 62852  >  80 [ACK] Seq=1 Ack=1 Win=254 Len=1;;;48.851478;48.851477;-1E-06;-0.022253;0.022252;0.044505
3670;48.851477;192.168.1.7;74.125.130.94;TCP;55;[TCP Keep-Alive] 62851  >  80 [ACK] Seq=1 Ack=1 Win=251 Len=1;;;48.851477;48.873729;0.022252;0.012931;0.009321;-0.00361
3671;48.873729;74.125.130.94;192.168.1.7;TCP;66;[TCP Keep-Alive ACK] 80  >  62851 [ACK] Seq=1 Ack=2 Win=265 Len=0 SLE=1 SRE=2;;;48.873729;48.88305;0.009321;-0.300478;0.309799;0.610277
3672;48.88305;74.125.130.94;192.168.1.7;TCP;66;[TCP Keep-Alive ACK] 80  >  62852 [ACK] Seq=1 Ack=2 Win=261 Len=0 SLE=1 SRE=2;;;48.88305;49.192849;0.309799;0.285909;0.02389;-0.262019
4137;49.192849;192.168.1.7;35.186.224.25;TCP;66;62863  >  443 [SYN] Seq=0 Win=64240 Len=0 MSS=1460 WS=256 SACK_PERM=1;;;49.192849;49.216739;0.02389;0.023687;0.000203;-0.023484
4138;49.216739;35.186.224.25;192.168.1.7;TCP;66;443  >  62863 [SYN, ACK] Seq=0 Ack=1 Win=65535 Len=0 MSS=1430 SACK_PERM=1 WS=256;;;49.216739;49.216942;0.000203;-0.000586;0.000789;0.001375
4139;49.216942;192.168.1.7;35.186.224.25;TCP;54;62863  >  443 [ACK] Seq=1 Ack=1 Win=65536 Len=0;;;49.216942;49.217731;0.000789;-0.021016;0.021805;0.042821
4140;49.217731;192.168.1.7;35.186.224.25;TLSv1.3;648;Client Hello;;;49.217731;49.239536;0.021805;0.005746;0.016059;0.010313
4141;49.239536;35.186.224.25;192.168.1.7;TCP;54;443  >  62863 [ACK] Seq=1 Ack=595 Win=66816 Len=0;;;49.239536;49.255595;0.016059;0.014947;0.001112;-0.013835
4142;49.255595;35.186.224.25;192.168.1.7;TLSv1.3;266;Server Hello, Change Cipher Spec, Application Data;;;49.255595;49.256707;0.001112;0.000842;0.00027;-0.000572
4143;49.256707;192.168.1.7;35.186.224.25;TLSv1.3;118;Change Cipher Spec, Application Data;;;49.256707;49.256977;0.00027;-2.2E-05;0.000292;0.000314
4144;49.256977;192.168.1.7;35.186.224.25;TLSv1.3;146;Application Data;;;49.256977;49.257269;0.000292;0.000109;0.000183;7.4E-05
4145;49.257269;192.168.1.7;35.186.224.25;TLSv1.3;855;Application Data;;;49.257269;49.257452;0.000183;0.000183;0;-0.000183
4146;49.257452;192.168.1.7;35.186.224.25;TCP;1484;62863  >  443 [ACK] Seq=1552 Ack=213 Win=65536 Len=1430 [TCP segment of a reassembled PDU];;;49.257452;49.257452;0;-0.019836;0.019836;0.039672
4147;49.257452;192.168.1.7;35.186.224.25;TLSv1.3;520;Application Data;;;49.257452;49.277288;0.019836;0.019387;0.000449;-0.018938
4148;49.277288;35.186.224.25;192.168.1.7;TLSv1.3;634;Application Data, Application Data;;;49.277288;49.277737;0.000449;0.000294;0.000155;-0.000139
4149;49.277737;192.168.1.7;35.186.224.25;TLSv1.3;85;Application Data;;;49.277737;49.277892;0.000155;-0.002247;0.002402;0.004649
4150;49.277892;35.186.224.25;192.168.1.7;TCP;56;443  >  62863 [ACK] Seq=793 Ack=1552 Win=69632 Len=0;;;49.277892;49.280294;0.002402;0.000387;0.002015;0.001628
4151;49.280294;35.186.224.25;192.168.1.7;TLSv1.3;85;Application Data;;;49.280294;49.282309;0.002015;-0.021044;0.023059;0.044103
4152;49.282309;35.186.224.25;192.168.1.7;TCP;56;443  >  62863 [ACK] Seq=824 Ack=3448 Win=75520 Len=0;;;49.282309;49.305368;0.023059;0.007056;0.016003;0.008947
4153;49.305368;35.186.224.25;192.168.1.7;TCP;56;443  >  62863 [ACK] Seq=824 Ack=3479 Win=75520 Len=0;;;49.305368;49.321371;0.016003;-0.115101;0.131104;0.246205
4154;49.321371;192.168.1.7;35.186.224.25;TCP;54;62863  >  443 [ACK] Seq=3479 Ack=824 Win=64768 Len=0;;;49.321371;49.452475;0.131104;0.129573;0.001531;-0.128042
4155;49.452475;35.186.224.25;192.168.1.7;TLSv1.3;511;Application Data;;;49.452475;49.454006;0.001531;-0.026212;0.027743;0.053955
4156;49.454006;192.168.1.7;35.186.224.25;TLSv1.3;93;Application Data;;;49.454006;49.481749;0.027743;-1.051543;1.079286;2.130829
4157;49.481749;35.186.224.25;192.168.1.7;TCP;56;443  >  62863 [ACK] Seq=1281 Ack=3518 Win=75520 Len=0;;;49.481749;50.561035;1.079286;1.053541;0.025745;-1.027796
4158;50.561035;192.168.1.7;35.197.154.200;TCP;55;[TCP Keep-Alive] 62843  >  443 [ACK] Seq=1 Ack=1 Win=260 Len=1;;;50.561035;50.58678;0.025745;-0.549113;0.574858;1.123971
4159;50.58678;35.197.154.200;192.168.1.7;TCP;66;[TCP Keep-Alive ACK] 443  >  62843 [ACK] Seq=1 Ack=2 Win=139 Len=0 SLE=1 SRE=2;;;50.58678;51.161638;0.574858;0.552608;0.02225;-0.530358
4168;51.161638;192.168.1.7;35.186.224.39;TLSv1.2;97;Application Data;;;51.161638;51.183888;0.02225;-0.038634;0.060884;0.099518
4169;51.183888;35.186.224.39;192.168.1.7;TCP;56;443  >  49752 [ACK] Seq=41 Ack=87 Win=272 Len=0;;;51.183888;51.244772;0.060884;0.009105;0.051779;0.042674
4170;51.244772;35.186.224.39;192.168.1.7;TLSv1.2;94;Application Data;;;51.244772;51.296551;0.051779;-1.133447;1.185226;2.318673
4171;51.296551;192.168.1.7;35.186.224.39;TCP;54;49752  >  443 [ACK] Seq=87 Ack=81 Win=252 Len=0;;;51.296551;52.481777;1.185226;1.095238;0.089988;-1.00525
4172;52.481777;192.168.1.7;35.186.224.47;TLSv1.2;89;Application Data;;;52.481777;52.571765;0.089988;0.031332;0.058656;0.027324
4173;52.571765;35.186.224.47;192.168.1.7;TCP;56;443  >  49748 [ACK] Seq=32 Ack=71 Win=266 Len=0;;;52.571765;52.630421;0.058656;0.007505;0.051151;0.043646
4174;52.630421;35.186.224.47;192.168.1.7;TLSv1.2;85;Application Data;;;52.630421;52.681572;0.051151;-0.728976;0.780127;1.509103
4175;52.681572;192.168.1.7;35.186.224.47;TCP;54;49748  >  443 [ACK] Seq=71 Ack=63 Win=255 Len=0;;;52.681572;53.461699;0.780127;0.754245;0.025882;-0.728363
4176;53.461699;192.168.1.7;35.186.224.25;TCP;54;62863  >  443 [FIN, ACK] Seq=3518 Ack=1281 Win=64256 Len=0;;;53.461699;53.487581;0.025882;0.025647;0.000235;-0.025412
4177;53.487581;35.186.224.25;192.168.1.7;TCP;54;443  >  62863 [FIN, ACK] Seq=1281 Ack=3519 Win=75520 Len=0;;;53.487581;53.487816;0.000235;-3.412656;3.412891;6.825547
4178;53.487816;192.168.1.7;35.186.224.25;TCP;54;62863  >  443 [ACK] Seq=3519 Ack=1282 Win=64256 Len=0;;;53.487816;56.900707;3.412891;3.356585;0.056306;-3.300279
4180;56.900707;157.240.218.60;192.168.1.7;TLSv1.2;189;Application Data;;;56.900707;56.957013;0.056306;-1.873154;1.92946;3.802614
